{
  "format": "od-knowledgecard-vocab",
  "version": 2,
  "elements": [
    {
      "id": "block",
      "name": "物块/滑块/小车（矩形实体：物块·方块·小车·冰壶·砖块）",
      "aliases": [
        "物块",
        "滑块",
        "木块",
        "方块",
        "方框",
        "长方形",
        "矩形",
        "小车",
        "叠放体",
        "托盘",
        "冰壶",
        "砖块",
        "砖",
        "铁块",
        "物体A",
        "物体B"
      ],
      "primitive": "Draw.box"
    },
    {
      "id": "board",
      "name": "长木板/平板（板·挡板·车板）",
      "aliases": [
        "木板",
        "长木板",
        "平板",
        "薄板",
        "挡板",
        "木板A",
        "木板B",
        "木板C",
        "车板",
        "板"
      ],
      "primitive": "Draw.box"
    },
    {
      "id": "incline",
      "name": "斜面/斜坡（含三角板·楔形）",
      "aliases": [
        "斜面",
        "粗糙斜面",
        "光滑斜面",
        "倾角",
        "斜坡",
        "滑坡",
        "斜面体",
        "三角板",
        "直角三角板",
        "直角三角形",
        "楔形",
        "阴面"
      ],
      "primitive": "Draw.incline"
    },
    {
      "id": "ball",
      "name": "球/圆筒/圆柱（圆形实体：小球·质点·滚轮·车轮·圆盘·转盘·圆筒）",
      "aliases": [
        "小球",
        "球",
        "球体",
        "质点",
        "滚轮",
        "车轮",
        "圆盘",
        "转盘",
        "圆柱",
        "圆柱体",
        "圆筒",
        "圆形",
        "圆"
      ],
      "primitive": "Draw.circle"
    },
    {
      "id": "arc_track",
      "name": "圆弧轨道/拱桥/球面（半圆·圆管·竖直圆轨道·半球面）",
      "aliases": [
        "圆弧轨道",
        "竖直圆轨道",
        "半圆轨道",
        "圆形轨道",
        "圆轨道",
        "拱桥",
        "弧形面",
        "圆弧面",
        "圆管",
        "细圆管",
        "圆弧",
        "半圆",
        "球面",
        "半球面"
      ],
      "primitive": "Draw.arc"
    },
    {
      "id": "ground",
      "name": "阴面/支撑面（斜线阴影·地面·桌面·墙面·天花板）",
      "aliases": [
        "斜线阴影",
        "阴影地面",
        "地面",
        "水平面",
        "桌面",
        "冰面",
        "粗糙地面",
        "墙面",
        "竖直墙面",
        "天花板",
        "斜线区域"
      ],
      "primitive": "Draw.ground"
    },
    {
      "id": "spring",
      "name": "弹簧（含弹性绳/弹簧测力计）",
      "aliases": [
        "弹簧",
        "轻弹簧",
        "轻质弹簧",
        "弹簧秤",
        "弹簧测力计",
        "弹性绳",
        "橡皮筋"
      ],
      "primitive": "Draw.spring"
    },
    {
      "id": "pulley",
      "name": "滑轮（定滑轮·动滑轮·滑轮组）",
      "aliases": [
        "滑轮",
        "定滑轮",
        "动滑轮",
        "滑轮组",
        "轻质滑轮",
        "光滑定滑轮"
      ],
      "primitive": "Draw.pulley"
    },
    {
      "id": "rope",
      "name": "绳/线（轻绳·细绳·悬线·拉线）",
      "aliases": [
        "绳",
        "轻绳",
        "细绳",
        "绳子",
        "轻质绳",
        "细线",
        "悬线",
        "拉线",
        "绳OP",
        "绳AB",
        "绳的张力"
      ],
      "primitive": "Draw.line"
    },
    {
      "id": "rod",
      "name": "杆/导轨（轻杆·细杆·导体棒·金属棒·平行导轨）",
      "aliases": [
        "杆",
        "轻杆",
        "直杆",
        "斜杆",
        "细杆",
        "刚性细杆",
        "导体棒",
        "金属棒",
        "金属杆",
        "导轨",
        "平行导轨",
        "金属导轨",
        "铁丝"
      ],
      "primitive": "Draw.line"
    },
    {
      "id": "stand",
      "name": "支架/立柱（铁架台·铁夹·方木板）",
      "aliases": [
        "铁架台",
        "支架",
        "铁夹",
        "立柱",
        "夹具",
        "方木板",
        "支架台",
        "斜杆支架"
      ],
      "primitive": "Draw.line"
    },
    {
      "id": "belt",
      "name": "传送带（皮带·履带）",
      "aliases": [
        "传送带",
        "传送皮带",
        "皮带",
        "履带",
        "运行的带",
        "传送带AB"
      ],
      "primitive": "Draw.belt"
    },
    {
      "id": "circuit",
      "name": "电路（电源·开关·电表·电阻·滑动变阻器·导线）",
      "aliases": [
        "电路",
        "电路图",
        "实物连线",
        "导线",
        "导线若干",
        "连线",
        "开关",
        "单刀双掷开关",
        "接线柱",
        "电源",
        "电池",
        "蓄电池",
        "电阻",
        "定值电阻",
        "滑动变阻器",
        "电阻箱",
        "电表",
        "电压表",
        "电流表",
        "多用电表",
        "电容器",
        "小电珠"
      ],
      "primitive": "Draw.line"
    },
    {
      "id": "plates",
      "name": "平行板/极板（带电板·偏转板·板间电场）",
      "aliases": [
        "平行板",
        "极板",
        "带电板",
        "偏转板",
        "平行金属板",
        "板间电场"
      ],
      "primitive": "Draw.line"
    },
    {
      "id": "ray",
      "name": "光线与光路（入射/反射/折射光线）",
      "aliases": [
        "光线",
        "光路",
        "入射光线",
        "出射光线",
        "折射光",
        "反射光",
        "入射光",
        "出射光",
        "折射光线",
        "反射光线"
      ],
      "primitive": "Draw.ray"
    },
    {
      "id": "lens",
      "name": "透镜/棱镜（凸透镜·凹透镜·玻璃砖·三棱镜）",
      "aliases": [
        "透镜",
        "凸透镜",
        "凹透镜",
        "玻璃砖",
        "三棱镜",
        "棱镜",
        "玻璃半球",
        "半圆柱玻璃砖",
        "玻璃柱"
      ],
      "primitive": "Draw.lens"
    },
    {
      "id": "field_region",
      "name": "匀强场区（磁场点叉阵列·电场箭头阵列·磁感线）",
      "aliases": [
        "匀强磁场",
        "匀强电场",
        "磁场",
        "电场",
        "磁场区域",
        "电场区域",
        "场区",
        "点叉阵列",
        "边界磁场",
        "叉号",
        "点阵",
        "磁感线"
      ],
      "primitive": "Draw.fieldDots"
    },
    {
      "id": "vector",
      "name": "矢量箭头（速度/加速度/力箭头；A25 算元件）",
      "aliases": [
        "矢量",
        "矢量箭头",
        "箭头",
        "速度箭头",
        "加速度箭头",
        "力箭头",
        "辅助矢量",
        "洛伦兹力箭头",
        "安培力箭头"
      ],
      "primitive": "Draw.arrow"
    },
    {
      "id": "trace_path",
      "name": "轨迹（平抛/斜抛/圆弧/曝光轨迹与描迹）",
      "aliases": [
        "轨迹",
        "运动轨迹",
        "路径",
        "虚线轨迹",
        "抛物线轨迹",
        "圆弧轨迹",
        "平抛轨迹",
        "斜抛轨迹",
        "抛体轨迹",
        "描迹",
        "曝光轨迹"
      ],
      "primitive": "Draw.trace"
    },
    {
      "id": "paper_tape",
      "name": "纸带与点迹（打点计时器纸带·计数点）",
      "aliases": [
        "纸带",
        "点迹",
        "打点计时器",
        "电磁打点计时器",
        "电火花计时器",
        "纸带点迹",
        "计数点"
      ],
      "primitive": "Draw.trace"
    },
    {
      "id": "ghosts",
      "name": "频闪与残影（频闪照片·连续曝光的位置点）",
      "aliases": [
        "频闪",
        "频闪照片",
        "闪光照片",
        "残影",
        "残影快照",
        "影格",
        "逐格位置",
        "连续曝光",
        "同形轮廓"
      ],
      "primitive": "Draw.ghosts"
    },
    {
      "id": "axis_box",
      "name": "坐标系（坐标轴框·网格纸；只在需要读图时算）",
      "aliases": [
        "坐标轴",
        "坐标图",
        "直角坐标系",
        "坐标纸",
        "坐标系",
        "坐标框",
        "直角坐标",
        "坐标系与网格",
        "网格纸"
      ],
      "primitive": "Draw.axisBox"
    },
    {
      "id": "chart",
      "name": "图线与数据点（v-t/x-t/U-I/p-V 图线；只在需要读图时算）",
      "aliases": [
        "图线",
        "数据点连线",
        "v-t图像",
        "x-t图像",
        "U-I图像",
        "p-V图像",
        "F-x图像",
        "实验图线",
        "图像",
        "曲线图",
        "折线图",
        "图表格"
      ],
      "primitive": "Draw.chart"
    },
    {
      "id": "graph_wave",
      "name": "波形图（正弦波·波峰波谷·驻波）",
      "aliases": [
        "波形",
        "波形图",
        "波动图像",
        "正弦波形",
        "正弦波",
        "波峰",
        "波谷",
        "驻波",
        "正弦曲线"
      ],
      "primitive": "Draw.curve"
    },
    {
      "id": "orbit",
      "name": "卫星与天体轨道（椭圆轨道·变轨·双星）",
      "aliases": [
        "卫星轨道",
        "椭圆轨道",
        "变轨",
        "双星轨道",
        "天体",
        "轨道"
      ],
      "primitive": "Draw.arc"
    },
    {
      "id": "cylinder_piston",
      "name": "气缸与活塞（注射器·封闭气体容器）",
      "aliases": [
        "气缸",
        "汽缸",
        "活塞",
        "注射器",
        "封闭气体",
        "容器",
        "导热容器"
      ],
      "primitive": "Draw.box"
    },
    {
      "id": "gas_tube",
      "name": "玻璃管与水银柱（U形管·汞柱）",
      "aliases": [
        "玻璃管",
        "水银柱",
        "汞柱",
        "U形管",
        "细管",
        "管",
        "气体柱"
      ],
      "primitive": "Draw.box"
    },
    {
      "id": "light_spot",
      "name": "光斑与光束（照射区域·光屏亮斑）",
      "aliases": [
        "光斑",
        "光束",
        "光带",
        "照射区域",
        "亮斑",
        "光屏",
        "圆形光斑"
      ],
      "primitive": "Draw.polygon"
    },
    {
      "id": "measuring_tool",
      "name": "测量器具实物（刻度尺·游标卡尺·螺旋测微器·光电门·秒表·天平；算元件）",
      "aliases": [
        "刻度尺",
        "直尺",
        "米尺",
        "游标卡尺",
        "螺旋测微器",
        "光电门",
        "遮光条",
        "遮光片",
        "挡光片",
        "秒表",
        "计时器",
        "天平",
        "传感器",
        "量角器",
        "读数"
      ],
      "primitive": "Draw.dimension"
    },
    {
      "id": "raw_composite",
      "name": "复合图形（碰撞·爆炸·碎片·火柴人·手）",
      "aliases": [
        "碰撞",
        "爆炸",
        "反冲",
        "粘在一起",
        "碎块",
        "火柴人",
        "碎片",
        "手"
      ],
      "primitive": "Draw.raw"
    }
  ],
  "scenes": [
    {
      "id": "conveyor_block",
      "name": "传送带 + 物块（共速/生热）",
      "aliases": [
        "传送带模型",
        "共速生热",
        "摩擦生热模型"
      ]
    },
    {
      "id": "incline_block",
      "name": "斜面 + 滑块（往返/静止）",
      "aliases": [
        "斜面模型",
        "滑块往返",
        "斜面滑块"
      ]
    },
    {
      "id": "circular_track",
      "name": "圆周轨道 + 小球（含脱离）",
      "aliases": [
        "圆周轨道模型",
        "竖直圆周",
        "脱离点"
      ]
    }
  ]
}
